<?xml version="1.0" encoding="UTF-8"?>
<mapping name="default" xmlns="http://xml.dpa.com/cl/metadatamapper/2014-08-08/" xmlns:xsi="http://www.w3.org/2001/XMLSchema-instance" xsi:schemaLocation="http://xml.dpa.com/cl/metadatamapper/2014-08-08/ file:///C:/dev/ws/service-dispatch/src/main/resources/mapping/xsd/metadata-mapping-1-0.xsd">
	<config>
		<timezone>Europe/Berlin</timezone>
		<iim charset="iso8859-15" characterMappingRef="utf8-to-iso8859-15" defaultReplaceChar="·"/>
		<xmp charset="utf-8" defaultReplaceChar="·"/>
	</config>
	<metadata name="City (legacy)" cardinality="ONE">
		<xpath rank="1"><![CDATA[//contentMeta/located/POIDetails/address/locality/name]]></xpath>
		<xpath rank="2"><![CDATA[//assert[@literal=//contentMeta/located/@literal]/POIDetails/address/locality/name]]></xpath>
		<xpath rank="3"><![CDATA[//assert[@qcode=//contentMeta/located/@qcode]/POIDetails/address/locality/name]]></xpath>
		<xpath rank="4"><![CDATA[//assert[@literal=//contentMeta/subject/@literal]/POIDetails/address/locality/name]]></xpath>
		<xpath rank="5"><![CDATA[//assert[@qcode=//contentMeta/subject/@qcode]/POIDetails/address/locality/name]]></xpath>
		<iim>
			<mapsTo dataset="90" field="City" targetType="STRING"/>
		</iim>
		<xmp>
			<mapsTo targetNamespace="http://ns.adobe.com/photoshop/1.0/" field="City" targetType="Text"/>
		</xmp>
	</metadata>
	<metadata name="Country (legacy)" cardinality="ONE">
		<xpath rank="1"><![CDATA[//contentMeta/located/POIDetails/address/country/name]]></xpath>
		<xpath rank="2"><![CDATA[//assert[@literal=//contentMeta/located/@literal]/POIDetails/address/country/name]]></xpath>
		<xpath rank="3"><![CDATA[//assert[@qcode=//contentMeta/located/@qcode]/POIDetails/address/country/name]]></xpath>
		<xpath rank="4"><![CDATA[//assert[@literal=//contentMeta/subject/@literal]/POIDetails/address/country/name]]></xpath>
		<xpath rank="5"><![CDATA[//assert[@qcode=//contentMeta/subject/@qcode]/POIDetails/address/country/name]]></xpath>
		<iim>
			<mapsTo dataset="101" field="Country/Primary Location Name" targetType="STRING"/>
		</iim>
		<xmp>
			<mapsTo targetNamespace="http://ns.adobe.com/photoshop/1.0/" field="Country" targetType="Text"/>
		</xmp>
	</metadata>
	<metadata name="Country Code (legacy)" cardinality="ONE">
		<xpath rank="1" returnType="STRING"><![CDATA[substring(//contentMeta/located/POIDetails/address/country/sameAs[substring(@qcode, 1, 12) ="iso3166-1a3:"]/@qcode,13)]]></xpath>
		<xpath rank="2" returnType="STRING"><![CDATA[substring(//contentMeta/located/POIDetails/address/country/sameAs[substring(@qcode, 1, 12) ="iso3166-1a2:"]/@qcode,13)]]></xpath>
		<xpath rank="3" returnType="STRING"><![CDATA[substring(//assert[@literal=//contentMeta/located/@literal]/POIDetails/address/country/sameAs[substring(@qcode, 1, 12) ="iso3166-1a3:"]/@qcode,13)]]></xpath>
		<xpath rank="4" returnType="STRING"><![CDATA[substring(//assert[@qcode=//contentMeta/located/@qcode]/POIDetails/address/country/sameAs[substring(@qcode, 1, 12) ="iso3166-1a3:"]/@qcode,13)]]></xpath>
		<xpath rank="5" returnType="STRING"><![CDATA[substring(//assert[@literal=//contentMeta/located/@literal]/POIDetails/address/country/sameAs[substring(@qcode, 1, 12) ="iso3166-1a2:"]/@qcode,13)]]></xpath>
		<xpath rank="6" returnType="STRING"><![CDATA[substring(//assert[@qcode=//contentMeta/located/@qcode]/POIDetails/address/country/sameAs[substring(@qcode, 1, 12) ="iso3166-1a2:"]/@qcode,13)]]></xpath>
		<iim>
			<mapsTo dataset="100" field="Country/Primary Location Code" targetType="STRING"/>
		</iim>
		<xmp>
			<mapsTo targetNamespace="http://iptc.org/std/Iptc4xmpExt/2008-02-29/" field="CountryCode" targetType="Text"/>
		</xmp>
	</metadata>
	<metadata name="Headline" cardinality="ONE">
		<xpath><![CDATA[//contentMeta/headline[@rank='1' or not(@rank)]]]></xpath>
		<iim>
			<mapsTo dataset="105" field="Headline" targetType="STRING"/>
		</iim>
		<xmp>
			<mapsTo targetType="Text" targetNamespace="http://ns.adobe.com/photoshop/1.0/" field="Headline"/>
		</xmp>
	</metadata>
	<metadata name="Description" cardinality="ONE">
		<xpath rank="1"><![CDATA[//contentMeta/description[@role='drol:caption']]]></xpath>
		<xpath rank="2"><![CDATA[//contentMeta/description[not(@role)]]></xpath>
		<iim>
			<mapsTo dataset="120" field="Caption/Abstract" targetType="STRING"/>
		</iim>
		<xmp>
			<mapsTo targetType="LangAlt" targetNamespace="http://purl.org/dc/elements/1.1/" field="description"/>
		</xmp>
	</metadata>
	<metadata name="Intellectual Genre" cardinality="ONE">
		<xpath rank="1"><![CDATA[/newsItem/contentMeta/genre/name]]></xpath>
		<xpath rank="2"><![CDATA[/newsItem/contentMeta/genre/@literal]]></xpath>
		<iim>
			<mapsTo dataset="4" field="Object Attribute Reference" targetType="STRING"/>
		</iim>
		<xmp>
			<mapsTo targetType="Text" targetNamespace="http://iptc.org/std/Iptc4xmpExt/2008-02-29/" field="IntellectualGenre"/>
		</xmp>
	</metadata>
	<metadata name="Keywords" cardinality="MANY">
		<xpath><![CDATA[//contentMeta/keyword | //contentMeta/subject[not(@type = 'dpatype:category')]/name]]></xpath>
		<iim>
			<mapsTo dataset="25" field="Keywords" targetType="LIST_OF_STRING"/>
		</iim>
		<xmp>
			<mapsTo field="Subject" targetType="Bag" targetNamespace="http://purl.org/dc/elements/1.1/">
				<mapsTo field="Subject" targetNamespace="http://purl.org/dc/elements/1.1/" targetType="Text"/>
			</mapsTo>
		</xmp>
	</metadata>
	<metadata name="Province or State (legacy)" cardinality="MANY">
		<xpath rank="1"><![CDATA[//contentMeta/located/POIDetails/address/area/name]]></xpath>
		<xpath rank="2"><![CDATA[//assert[@literal=//contentMeta/located/@literal]/POIDetails/address/area/name]]></xpath>
		<xpath rank="3"><![CDATA[//assert[@qcode=//contentMeta/located/@qcode]/POIDetails/address/area/name]]></xpath>
		<xpath rank="4"><![CDATA[//assert[@literal=//contentMeta/subject/@literal]/POIDetails/address/area/name]]></xpath>
		<xpath rank="5"><![CDATA[//assert[@qcode=//contentMeta/subject/@qcode]/POIDetails/address/area/name]]></xpath>
		<iim>
			<mapsTo dataset="95" field="Province/State" targetType="STRING"/>
		</iim>
		<xmp>
			<mapsTo targetNamespace="http://ns.adobe.com/photoshop/1.0/" field="State" targetType="Text"/>
		</xmp>
	</metadata>
	<metadata name="Scene Code" cardinality="MANY">
		<xpath rank="1"><![CDATA[//contentMeta/genre/@qcode]]></xpath>
		<xmp>
			<mapsTo targetNamespace="http://purl.org/dc/elements/1.1/" field="Scene" targetType="Bag">
				<mapsTo field="Scene" targetNamespace="http://purl.org/dc/elements/1.1/" targetType="Text"/>
			</mapsTo>
		</xmp>
	</metadata>
	<metadata name="Subject Code" cardinality="MANY">
		<xpath rank="1" returnType="STRING"><![CDATA[substring(//contentMeta//subject[starts-with(@qcode, 'subj:')]/@qcode, 6)]]></xpath>
		<iim>
			<mapsTo field="Subject Reference" dataset="12" targetType="LIST_OF_STRING"/>
		</iim>
		<xmp>
			<mapsTo targetNamespace="http://iptc.org/std/Iptc4xmpExt/2008-02-29/" field="SubjectCode" targetType="Bag">
				<mapsTo field="SubjectCode" targetNamespace="http://purl.org/dc/elements/1.1/" targetType="Text"/>
			</mapsTo>
		</xmp>
	</metadata>
	<metadata name="Subjectlocation (legacy)" cardinality="MANY">
		<default/>
		<iim>
			<mapsTo field="Sublocation" dataset="92" targetType="STRING"/>
		</iim>
		<xmp>
			<mapsTo targetNamespace="http://iptc.org/std/Iptc4xmpExt/2008-02-29/" field="Location" targetType="Text"/>
		</xmp>
	</metadata>
	<metadata name="Date Created" cardinality="ONE">
		<xpath><![CDATA[//contentMeta/contentCreated]]></xpath>
		<iim>
			<mapsTo dataset="55" field="Date Created" targetType="STRING"/>
		</iim>
		<xmp>
			<mapsTo targetNamespace="http://ns.adobe.com/photoshop/1.0/" targetType="Date" field="DateCreated"/>
		</xmp>
	</metadata>
	<metadata name="Description Writer" cardinality="ONE">
		<xpath rank="1"><![CDATA[//contentMeta/contributor[@role="ctrol:descrWriter"]/name]]></xpath>
		<xpath rank="2"><![CDATA[//contentMeta/contributor/name]]></xpath>
		<iim>
			<mapsTo dataset="122" field="Writer/Editor" targetType="STRING"/>
		</iim>
		<xmp>
			<mapsTo targetNamespace="http://ns.adobe.com/photoshop/1.0/" targetType="Text" field="CaptionWriter"/>
		</xmp>
	</metadata>
	<metadata name="Instructions" cardinality="ONE">
		<xpath><![CDATA[//itemMeta/edNote]]></xpath>
		<iim>
			<mapsTo dataset="40" field="Special Instructions" targetType="STRING"/>
		</iim>
		<xmp>
			<mapsTo targetType="Text" targetNamespace="http://ns.adobe.com/photoshop/1.0/" field="Instructions"/>
		</xmp>
	</metadata>
	<metadata name="Job Id" cardinality="ONE">
		<xpath><![CDATA[//contentMeta/altId[@type='dpatype:orgTransRef']]]></xpath>
		<iim>
			<mapsTo dataset="103" field="Original Transmission, Reference" targetType="STRING"/>
		</iim>
		<xmp>
			<mapsTo targetType="Text" targetNamespace="http://ns.adobe.com/photoshop/1.0/" field="TransmissionReference"/>
		</xmp>
	</metadata>
	<metadata name="Title" cardinality="ONE">
		<xpath rank="1"><![CDATA[//contentMeta/title]]></xpath>
		<xpath rank="2"><![CDATA[//contentMeta/headline[not(@rank) or @rank='1']]]></xpath>
		<xmp>
			<mapsTo targetType="LangAlt" targetNamespace="http://purl.org/dc/elements/1.1/" field="title"/>
		</xmp>
	</metadata>
	<metadata name="Copyright Notice" cardinality="ONE">
		<xpath rank="1"><![CDATA[//rightsInfo/copyrightNotice]]></xpath>
		<xpath rank="2" returnType="STRING"><![CDATA[concat('(c) ',//rightsInfo/copyrightHolder/name)]]></xpath>
		<default>(c) dpa</default>
		<iim>
			<mapsTo dataset="116" field="Copyright Notice" targetType="STRING"/>
		</iim>
		<xmp>
			<mapsTo targetType="LangAlt" targetNamespace="http://purl.org/dc/elements/1.1/" field="rights"/>
		</xmp>
	</metadata>
	<metadata name="Creator" cardinality="MANY">
		<xpath><![CDATA[//contentMeta/creator/name]]></xpath>
		<iim>
			<mapsTo dataset="80" field="By-line" targetType="LIST_OF_STRING"/>
		</iim>
		<xmp>
			<mapsTo targetNamespace="http://purl.org/dc/elements/1.1/" targetType="Sequence" field="creator"/>
		</xmp>
	</metadata>